,text,economy
92,"<p> </p><p>Ladies and gentlemen,</p><p>Thank you for your warm welcome. It's a pleasure to be here at the Federal Reserve Bank of Atlanta. A fitting place to talk about a crucial issue. </p><p> Today, I'd like to tell you about two young Dutchmen who went to San Francisco to study in 2011. There, they created the 'Hack 100'. A list of 100 high-tech businesses whose websites they checked for security vulnerabilities. They reported any problems directly to the companies, one of which was Facebook. Alex Rice, Head of Product Security, was impressed and decided to invest in the project. This led to the creation of HackerOne. The company has now located and resolved more than 12,000 security vulnerabilities on the websites of major players like Yahoo, Airbnb and Twitter. Making the internet safer as a result. It's a fantastic example of Dutch-US cooperation. One of those young Dutchmen, Michiel Prins, is taking part in this trade mission, together with some of his colleagues.</p><p>Every day these people deal with the focus of this seminar: the impact of emerging technologies on financial services and cyber security. It's about more than one flaw on one site. The internet shapes our daily lives. Everything from our social contacts to our security and infrastructure. It has given us a lot. Like access to information anywhere in the world. And new, smart ways of doing business that increase economic growth and employment. But it has also brought risks.</p><p>We must remember that everything - including vital sectors like energy, telecommunications, banking and security - is linked to the internet. So society can't function without network availability. And that makes it vulnerable. Disrupt the system and you disrupt society itself.</p><p> </p><p>The internet also offers criminals opportunities to 'go global'. We've all heard media reports about cyber crime and its consequences. More and more companies and financial institutions are the target of sophisticated cyber attacks. Causing serious economic damage. That's why tackling cyber crime - or, better yet, promoting cyber security - is vital if we want to safeguard the internet.</p><p> </p><p>International cooperation between governments and the private sector is an essential part of this.The internet transcends national borders. Countries must share information and fight cyber crime together.</p><p> </p><p>In the Netherlands, public-private cooperation is a big priority. A successful example of this approach is the Dutch Information Sharing and Analysis Centre which tackles cyber attacks on the financial sector. And it's working: in 2014 the damage caused by payment traffic fraud in the Netherlands was half that in 2013. </p><p> Cyber crime is a problem for major multinationals and institutions too. And it's often startups that can offer the quick and flexible solutions needed. That's why, in the Netherlands, we're seeing more and more big businesses and banks joining forces with startups.</p><p> </p><p>I don't think it's a coincidence that 2 young Dutchmen helped found HackerOne. The Netherlands and Flanders are world-leaders when it comes to creating and using innovative digital technologies. Our payment systems are some of the most advanced in the world. So is our IT infrastructure. It's no accident that the Netherlands is home to the world's second-largest internet exchange point. For several years now, our region has been home to a booming cyber-security and FinTech startup scene.</p><p> </p><p>At the same time, Atlanta is gaining a reputation as the Silicon Valley of FinTech and cyber security. Hence the nickname 'Transaction Alley'. And institutions like world-renowned Georgia Tech are providing the knowledge to make this happen.</p><p> </p><p>It's vital that we bring together expertise from the Netherlands, Flanders and Atlanta.</p><p> </p><p>The Dutch-Flemish region is a digital information and logistics hub. Atlanta is the FinTech and cyber-security centre of the world. All have large, tech-savvy workforces with lots to offer each other. And that could lead to new innovations, economic growth and jobs. But it goes deeper than that. It's about enhancing our safety and security. It's about reducing terrorist threats. It's about privacy and quality of life. That's what makes today's discussion so crucial.</p><p> </p><p>Thank you.</p>",3
93,"<p> </p><p>Ladies and gentlemen,</p><p> </p><p>Think of Atlanta and you think of Coca-Cola. Think of the Netherlands and you think of Heineken. Both are great export products and are among the most famous brand names in the world. I must admit that one is a bit more famous than the other. But I think we can agree that we both know about beverages!</p><p> </p><p>I mention these companies for a reason. They are excellent examples of the growing cooperation between the Dutch-Flemish region and Atlanta. Heineken has a distribution centre here in the Port of Savannah. And Coca-Cola Enterprises just expanded its operations in the Netherlands by opening one of Europe's most advanced production sites in Dongen. </p><p> </p><p>But beverages are not the only thing we have in common. We are on different continents, with an ocean between us. We might seem to be worlds apart, but we are not. And the American entrepreneurs here today know that better than anyone. We very much appreciate your investment in the Netherlands and your selecting the Netherlands-Flanders business delta to create a foothold in Europa.</p><p> </p><p>The Dutch and Flemish businesses on this trade mission are equally interested in technology matchmaking and doing business in the US. That's because business is in our DNA and has been for centuries. We've always looked beyond our borders.</p><p>And today - to paraphrase Ray Charles - we've got Georgia on our mind.</p><p> </p><p>In fact, we've got each other on our minds, and that's why the economic ties between the Netherlands, Flanders and Atlanta are growing. The value of exports from Georgia to the Netherlands is 850 million dollars a year. And exports in the other direction are worth 900 million dollars a year. That's a total export value of nearly two billion dollars.</p><p> </p><p>It makes sense that ties between our regions are growing closer. Just as Georgia is a gateway to the US, the Netherlands and Flanders are the gateway to Europe. </p><p> You have the great port of Savannah; we have the great ports of Rotterdam and Antwerp. These are crucial logistics hubs in the US and Europe.</p><p> </p><p>But our regions are also leaders in information technology. And in this field, the sky's the limit. I recently heard someone say that digital development is the circulatory system of the new economy. There's a great need for smart ideas and innovations. In the Netherlands and Flanders, we know that. And in Atlanta, you know it better than anyone. Your city has been called the new Silicon Valley of FinTech and cyber security.</p><p> </p><p>Amsterdam has also proven to be fertile ground for startups. Take the software company Backbase, a member of our trade delegation. Backbase creates smart customer interactions for mobile apps, and has long outgrown its startup status. This week they are opening an office in Atlanta.</p><p> </p><p>And that's only one of many examples. Startups are springing up all over the Netherlands, not only in Amsterdam. This is thanks to our innovative mind-set and enterprising spirit. The Netherlands is home to leading technology clusters, with world-class R&D in the fields of agrifood, life sciences and health, chemicals and high-tech. In these clusters, business, academia and government work together in a truly unique way, creating a climate for innovation. And we have an educated and flexible workforce with an open, international and pro-business mentality.</p><p> </p><p>But you've already noticed that. Many of you have been active in the Netherlands for many years and you continue to grow your business and expand your operations. </p><p> This past year, we've seen new companies from Georgia starting operations in the Netherlands, like Inmark, Kids II, Speakeasy and Spanx. And Dutch companies like KLM and BCD are opening locations in Georgia.</p><p> </p><p>That's exciting. And the innovative power of the Netherlands, Flanders and Georgia offers many more opportunities in FinTech, information security and logistics. </p><p> That's why I'm happy you're all here today. My colleagues from the NFIA and I will listen carefully to your needs. We want to know what you need to keep your business booming in Europe, so that we can provide a pro-business investment climate and maintain our leading position. In the words of the legendary Yogi Berra - may he rest in peace: 'when you arrive at a fork in the road, take it'. Well, we plan to take it.</p><p> </p><p>Thank you.</p>",2
94,"<p>Mayor Reed, Ladies and gentlemen, </p><p> It's a pleasure and an honour to be at this fantastic venue this evening. </p><p> I studied history at university. So a dinner at the Atlanta History Center really appealed to me. This impressive building radiates a love of history and respect for the past. </p><p> The Atlanta History Center has plenty of stories to tell. This city and region have a rich and varied history. You can see that from the many exhibitions in this building. </p><p> They cover everything from the American Civil War and the film classic Gone with the Wind, to the 1996 Olympic Games. </p><p> And I saw it for myself yesterday, when I visited the Martin Luther King Jr. National Historic Site. The story of Dr King’s fight for freedom and justice is still an inspiration to us all. Freedom and justice are values we promote worldwide. They bind our countries together. They form the basis of our friendship and our political, military and economic partnerships. </p><p> The Dutch, Americans and Flemish have a no-nonsense approach to doing business. Our focus is on solutions, not problems. This shared mentality has created excellent trade ties, which are more than 4 centuries old. And we’re still going strong. What’s more, there are lots of new opportunities. That’s why we're working to make trade between Europe and the US easier, with the Transatlantic Trade and Investment Partnership. </p><p> Trade and investment between my country and the US have created almost 24,000 jobs in Georgia and the Netherlands. For years the Netherlands has been among the top 5 foreign investors in the US. And the US, for its part, is the biggest foreign direct investor in the Netherlands. </p><p> But there's always room for improvement. And that’s why Minister President Bourgeois and I are here today. We have brought along a delegation of Dutch and Flemish IT and logistics companies. And they are all very interested in exploring business and technology matchmaking opportunities. </p><p> The reason for Flanders and the Netherlands joining forces on this trade mission is obvious. Not only do we share a language, culture and history: the Dutch-Flemish delta region is considered the ‘gateway to Europe’. This is thanks to the ports of Antwerp and Rotterdam, Amsterdam Schiphol Airport and the region’s excellent roads and waterways. And we have a counterpart in Georgia. Atlanta’s international airport is a major hub for domestic air traffic, and more than 12,300 logistics companies have branches in the region. Georgia is one of America's fastest-growing states in terms of its economy and population. And Atlanta is its beating heart. </p><p> But there's more. One of the most famous products to emerge from this city is Coca Cola. For years, pharmacist John Pemberton sold a popular alcoholic drink. When prohibition came into force in Atlanta in 1885, he replaced the wine in his drink with sugar syrup. It's a story which really speaks to me. Because it shows the power of inventiveness and flexibility. Pemberton didn’t see an obstacle in prohibition. He saw an opportunity. And then created the most famous soft drink in the world. </p><p> </p><p> This was more than a century ago. But Pemberton’s innovative spirit lives on. </p><p> Atlanta is gaining a reputation around the world as the Silicon Valley of financial technologies and information security. More than 70 per cent of all online payments in the US go through Georgia’s 'Transaction Alley'. </p><p> Innovative FinTech and cyber-security startups are also sprouting up across the Netherlands and Flanders. In fact, Amsterdam is quickly becoming one of the FinTech capitals of the world. Just look at companies like Backbase and Parkmobile: high-tech businesses leading the global digital applications sector. </p><p> Ladies and gentlemen, </p><p> With all this exciting potential, maybe we should ask ourselves why we didn't visit sooner. The innovative power of the Netherlands, Flanders and Georgia offers exciting opportunities in financial technologies, information security and logistics. </p><p> I'm looking forward to a fascinating evening. Please take the opportunity to get to know each other, hatch some plans and make a few deals that will benefit us all. </p><p> Thank you.</p>",2
95,"<p> </p><p>Governor, </p><p> First Lady of Georgia, </p><p> Brigadier General, </p><p> Commissioner, </p><p> Your Excellencies, </p><p> ladies and gentlemen,</p><p> </p><p>70 years ago, Europe and the Netherlands were liberated by brave, young Americans. 70 years ago, those courageous soldiers put their lives on the line for peace and security on the other side of the world. 70 years ago, far too many of them died a long way from home.</p><p> </p><p>This May on Memorial Day I was at the American cemetery in Margraten, a solemn and moving place in the hills of the southern Netherlands. Today, more than 8,000 white marble crosses bear silent witness to the sacrifices that were made.</p><p>People still in the flush of youth, like Private First Class Robert Long of Worth County, Georgia. These sons and daughters answered the call to fight for a country they didn’t know and for people they’d never met. They left their homes, families and loved ones behind. Families who waited in vain for them to return.  </p><p> </p><p>As always, that visit made a deep impression on me. In 2005 the entire Dutch government attended the memorial with President Bush. And this year too, there were veterans and surviving relatives there whose advanced age may prevent them from visiting the graves of their loved ones again. But as I said to them: the people of Europe will never forget them. We will keep saying their names and telling their stories.</p><p> </p><p>All the graves at Margraten have been adopted by people who live close by. By families and school classes. There’s even a waiting list. Year in and year out, these people tend the graves. They write to the families of the fallen, and arrange visits back and forth. And they do it out of respect and gratitude to our liberators.</p><p> </p><p>It is an honour to pay my respects to them on American soil today. The Netherlands will be forever grateful for the sacrifices that Americans made to secure our freedom. Today, we remember the fallen and honour the men and women willing to give their lives to make the world a safer place - in the past, and today. Men and women like Airman 1st Class Kcey Ruiz from Georgia, who was killed in a plane crash in Afghanistan, only this Friday. Our thoughts are with her family.</p><p> </p><p>The courage of these heroes still inspires us today. It inspires us to keep working for peace and security worldwide. Just as the United States and the Netherlands have fought shoulder to shoulder in Korea, Afghanistan and in the battle against ISIS.</p><p> </p><p>Our joint efforts symbolise the age-old friendship between our two countries. A friendship based on shared values. On our deep-rooted faith in democracy, freedom, justice and human rights.</p><p> </p><p>Seventy years later, freedom is still not a given for everyone. Thousands of refugees are knocking on Europe's door because they fear for their lives in their own country. We have a duty to our liberators to keep working for peace worldwide. Together we must work to achieve the liberty that General Eisenhower called for.</p><p> </p><p>On the eve of D-Day, the general encouraged the troops with his Order of the Day. He said, 'The free men of the world are marching together to victory. I have full confidence in your courage, devotion to duty and skill in battle. '</p><p> </p><p>The courage, devotion and skill of those free men still resonate 70 years later, in the hills of the southern Netherlands and here today. Thanks to them we stand here in freedom.</p><p> </p><p>Thank you.</p>",0
96,"<p> </p><p>Mr President, esteemed colleagues, ladies and gentlemen,</p><p>On 8 January this year I stood among thousands of people on Dam Square in Amsterdam. It was one day after the cowardly attack in Paris on the editorial staff of Charlie Hebdo. One day after the cold-blooded murder of twelve innocent people. People around the world were deeply affected by these events. 'Je suis Charlie'. </p><p> We said it in Amsterdam too.</p><p>It was an evening I'll never forget. There we stood, united and resolute. Men and women from all corners of the earth, young and old, people of every religious background. And our message to terrorists was loud and clear. We are different and yet we are one. We are the majority. And we will not let you divide us. </p><p> 'Hands off our freedom', were my words that night. And I can still feel the emotion of that moment.</p><p> </p><p>Da'esh and violent extremism are not other people's problems. Not only are countries like Syria and Iraq being completely destabilised, this threat also spreads insecurity and fuels tensions in our own communities. That is why the Netherlands is and will remain so actively involved in the fight against Da'esh and in combating violent extremism. We have an obligation to help foster international peace and stability. And we cannot take our own freedom for granted. So we stand shoulder to shoulder with many other countries, in the region and beyond, in the coalition against Da'esh.</p><p>Dutch F-16s are involved in the air campaign against Da'esh targets on a daily basis. We have sent military trainers and equipment to Iraq to train the Iraqi army and the Peshmerga. We are also providing emergency aid, implementing counter-messaging strategies and working on capacity building. It's not an easy task, but it is crucial. When people are being beheaded and ancient heritage sites are being destroyed with sledgehammers, we must respond. And we must respond there where it is happening. </p><p> </p><p>A second track the Netherlands is following is prevention. In our own country we've developed a broad programme, focusing not only on potential foreign terrorist fighters, but on parents, schools, local government and the local police too.</p><p>If we can give young - often impressionable - people the prospect of a good future, they will be less drawn to extremist groups. The idea is that intervening early in their immediate social environment is the best way to stop young people being tempted to go off to fight abroad. Any kind of positive and moderate influence can help.</p><p>Our approach is inclusive where possible, but repressive where necessary. Our international efforts include working with partners in the Global Counterterrorism Forum. The Forum is the primary platform where countries can share knowledge and information in order to prevent terrorism. A few days ago the Netherlands became co-chair of the Forum, affirming our long-term commitment. The Forum complements and collaborates with the UN and other organisations. Over the past year there's been a big focus on how to prevent potential foreign terrorist fighters from travelling abroad. And how to deal with those who come back.</p><p> </p><p>The fact is that violent extremism and terrorist groups like Da'esh, Al-Qa'ida, Jabhat al Nusra and Boko Haram are constantly evolving. This is not a static threat, and it will not simply disappear. The international community cannot afford to sit back. We must be vigilant and persistent. We must continue to make it clear that we are not fighting a religion.</p><p>We are fighting terrorists who carry out attacks and whose barbarism knows no bounds. For that reason too, it's good that we're meeting here today. </p><p> The Netherlands remains fully committed to the task ahead. Freedom is our inspiration. Resolve is our weapon. And together we will succeed in pushing back the terrorist threat.</p><p>Thank you.</p>",0
97,"<p>Mr President, ladies and gentlemen, </p><p>President Franklin D. Roosevelt once said, 'When peace has been broken anywhere, the peace of all countries everywhere is in danger'. These words capture the spirit of today's summit.  </p><p>We're here to renew our commitment to the UN's aim of promoting peace and security worldwide. I'd like to thank President Obama and UN Secretary-General Ban Ki-moon for this important initiative. We face big challenges and we have high expectations of UN peace missions. So we must make sure we keep supplying the UN with enough people and resources. After all, we are the UN.</p><p>The past few years have brought war and conflict very close to home. The violence, the enormous refugee flows: we cannot ignore what is happening.</p><p>The Kingdom of the Netherlands has a long-standing tradition of active involvement in international affairs. That commitment explains our candidacy for a seat on the UN Security Council in 2017 and 2018. Since 1947 our country has been involved in more than sixty UN-mandated missions in over thirty countries, deploying more than 125,000 men and women. The belief underlying our contributions to these missions has always been that in many conflict situations, it is only the UN that can legitimately intervene. </p><p>That belief also prompted us to host a European prelude to this summit in Amsterdam last February. More than forty countries attended and reaffirmed their support for UN peace missions and how to make these missions more effective. The Netherlands believes the basis should be a clear mandate and an integrated approach. Regional partnerships and better cooperation with local communities are essential.</p><p>The Netherlands will remain fully committed to peacekeeping in the years ahead. </p><p>Let me be specific:</p><p>Ladies and gentlemen, the importance of UN peace missions is beyond question. One conflict, in one country or one continent, affects us all. But to stay effective, we must keep working, keep innovating and keep focusing. </p><p>The Netherlands stands ready to play its part.</p><p>Thank you.</p>",0
