,text,economy
55,"<p>I am here today because of the MH17 air disaster. This tragedy has left deep wounds in the societies affected. Above all, it has devastated the loved ones of the victims. They must now live every day with the pain of their loss. I would like to take this opportunity to express my appreciation once again for the excellent cooperation we experienced with Malaysia in the aftermath of the disaster.</p><p>Together with Australia, which was also hit hard by the disaster, Malaysia and the Netherlands form a 'coalition of the grieving'.</p><p>All three countries are working closely to achieve our common goals: repatriating any further human remains and personal belongings, investigating the facts of the disaster and conducting a criminal investigation. Conditions on the ground remain difficult. But we remain determined to achieve these goals. Last week conditions allowed a small team to visit the crash site. They found remains of victims, which will be transferred to the Netherlands following the usual ceremonial protocol. We will continue to take every opportunity to go to the site.</p><p>Prime Minister Najib has demonstrated his personal commitment to this issue time and again - as we saw for ourselves when he visited the Netherlands in July. Now it is essential that we continue working together closely, and that we keep this subject high on the international agenda.</p><p>Following the MH370 tragedy, the downing of flight MH17 was Malaysia's second air disaster in a short space of time. As a result, a large number of next of kin have been living for many months in an agony of uncertainty about what exactly happened to their loved ones.</p><p>A Dutch company is involved in the search for the missing MH370 aircraft. I truly hope that the search will eventually provide the next of kin with the certainty they need.</p>",0
56,"<p>Mr President, </p><p> Mr Secretary-General, </p><p> Excellencies, </p><p> fellow delegates, </p><p> ladies and gentlemen,</p><p>On 17 July, in a summer already marked by alarming reports from Syria, Iraq and Gaza, our country was confronted with stark international reality. The 298 passengers of flight MH17 would be alive today if not for the Crimea conflict and the destabilisation of eastern Ukraine. 196 of the victims were Dutch nationals. This tragedy has had an enormous impact on our country. So many innocent men, women and children. Entire families ripped from neighbourhoods, empty desks in offices and schools, teammates gone forever. Everyone in the Netherlands knew someone in that plane, directly or indirectly, and we will feel the pain for years to come. Some of the victims still haven't been identified, and this must be done as soon as possible. Nothing is more important to their loved ones, wherever in the world they may be.</p><p>This summer we were reminded again of how closely interwoven events at home and abroad can be. And how important a stable world order is to our national interests. We saw again that when it comes to addressing the major problems facing the global community, there is simply no alternative to working together and taking a multilateral approach. This is the firm conviction of the Dutch government. We are grateful for the wide support for Security Council resolution 2166. All remains and personal belongings need to be repatriated. The cause of the MH17 disaster must be brought to light and those responsible must be brought to justice. Unhindered access to the crash site is therefore essential. The Dutch government is fully committed to achieving these goals, working with all the countries and organisations involved.</p><p>The Constitution of the Kingdom of the Netherlands contains a unique article that says: 'The Government shall promote the development of the international legal order'. This self-imposed responsibility comes from a long tradition of freedom, respect for the rule of law and our country's international orientation. In March 2014 we put this principle into practice once again when we hosted the Nuclear Security Summit, a conference on an important topic that must remain high on the international agenda. The events of this summer have made us even more resolute about promoting the international legal order. And about working to this end with everyone in this General Assembly, in the knowledge that peace, justice and development are closely interconnected.</p><p>2015 is an important year for the global development agenda. We will be reviewing the Millennium Development Goals and raising the bar once again. In July the Open Working Group on Sustainable Development Goals laid a solid foundation for the future that reflects the Netherlands' priorities. The most important goal is to eradicate extreme poverty within a generation in a way that doesn't harm economic growth, social equality or the environment. We must link short-term goals with long-term goals.</p><p>And despite the progress made, we know that fragile states, where the rule of law barely exists, had no chance of achieving the Millennium Goals. In 2013 there were more displaced people in conflict regions than ever before. For these reasons the Netherlands applauds the Open Working Group's intention to include peace and the rule of law in the new framework. We welcome the initiative by the SG to establish the UN mission for ebola emergency response. The Netherlands will substantially increase its humanitarian aid. Part of that effort is a new contribution of 18 mln euros devoted to fighting ebola.</p><p>In the same vein, the Netherlands will continue to support and participate in UN peacekeeping missions. We currently have military personnel and relief workers serving in Mali, South Sudan and elsewhere. The upcoming review of peacekeeping missions is an opportunity to improve this instrument and make it more effective. The Netherlands believes that major progress can be made on this front by further integrating the three Ds: defence, development and diplomacy. Our commitment to fulfilling Security Council resolution 1325 remains firm too. Because women's leadership is essential to achieving peace and security. The important role that women play as change agents in politics, economic development and society cannot be emphasised enough. As host country to many international legal institutions, including the International Court of Justice and the International Criminal Court, the Netherlands feels a special responsibility with respect to international law. When innocent people fall victim to impunity, human rights violations and the violence of war, the international community cannot and should not just stand by and watch. Perpetrators must be brought to justice, however complex and time-consuming the process may be.</p><p>We owe this not only to the passengers of flight MH17, but also to the victims of violence in Syria and Iraq. The horrifying images of mass executions and beheadings in the region are burned into our memories. They impress upon us how important it is for the Security Council and international legal institutions to be able to act boldly and decisively.</p><p>The Kingdom of the Netherlands, your partner for peace, justice and development, is a candidate for a non-permanent seat on the Security Council in 2017 and 2018. We want to help modernise and strengthen this important UN body. Renewal is needed to ensure its effectiveness and legitimacy. The Security Council must be able to act in a crisis. When mass atrocities are being committed somewhere in the world, veto power should be exercised with greater restraint. We salute the French initiative in this regard. We also believe that the Security Council's authority and resolve would be enhanced if the UN member states were more broadly represented. This is especially true of the African states, which in our opinion are underrepresented.</p><p>Ladies and gentlemen, </p><p> Dag Hammarskjöld once said in this assembly that the principles of the Charter of the United Nations '[…] are, by far, greater than the Organization in which they are embodied, and the aims which they are to safeguard are holier than the policies of any single nation or people.'</p><p>The Netherlands shares this conviction and remains steadfast in its commitment to promoting the international legal order, as our Constitution demands. </p><p> Thank you.</p>",2
57,"<p>Madam President,</p><p>The direct threat posed by foreign terrorist fighters concerns us all. Both our international and our national security are at risk. As a country of origin for such fighters, the Netherlands raised its terrorist threat level to the second highest level eighteen months ago.</p><p>But most alarming of all is the situation in the conflict zones themselves. Innocent civilians are victims of merciless violence. The threat is serious, and it calls for a serious response. This is a duty that rests on us, the international community. That is also the reason why today the Dutch government decided to increase its support to the international effort to stop ISIS by providing military means. We will provide F16's and military training and advice. In total we provide 380 men and women.</p><p>Last year, in the framework of the Global Counterterrorism Forum (GCTF) the Netherlands and Morocco launched a joint initiative to formulate good practices in tackling the problem of foreign terrorist fighters. Yesterday, at the GCTF ministerial meeting, we presented the outcome: a comprehensive set of guidelines focused on every aspect of the foreign fighter threat. These recommendations cover not only counterterrorism responses, but also preventive efforts.</p><p>As co-leader of the Forum’s working group on foreign terrorist fighters, the Netherlands will promote the adoption of these good practices. We are open to working actively with all UN member states and UN partners on this issue.</p><p>The UN sanctions regime is essential to addressing the problem of foreign terrorist fighters. Sanctions are an important instrument for depriving terrorist organisations and fighters of their sources of finance. And sanctions could be tightened further. These sanctions, however, must be implemented and monitored properly. Or they won’t be effective in practice. We should, I believe, examine at UN level whether the monitoring and technical assistance provided to member states can be enhanced.</p><p>Madam President,</p><p>It is vital that the international community act jointly on this issue. The resolution adopted today and cosponsored by the Netherlands, sends a strong signal that we should stand shoulder to shoulder to confront the threat posed by foreign terrorist fighters.</p><p>Madam President, thank you.</p>",0
58,"<p>Secretary-General, esteemed colleagues, ladies and gentlemen,</p><p>At some point you may have landed at Amsterdam Airport without realising that the runway was over four metres below sea level. </p><p> This is a good example of our geography as a low-lying delta region. </p><p> Without dams and dikes, more than half our country would be under water all or part of the time. </p><p> So you can imagine that climate change and its effects are a major concern in my country, and we are determined to take action.</p><p>In brief, my message to you today is: if we act now and if we act together, we can mitigate climate change and we can adapt to the physical and environmental challenges we face. </p><p> Both sides of this equation are important. </p><p> And in both cases, cooperation is crucial.</p><p>First and foremost, I mean international cooperation between countries and regions, and our shared responsibility to confront climate change. </p><p> That's why we're here. </p><p> That's why we aim to forge an ambitious climate agreement next year in Paris. </p><p> All countries must contribute in line with their ability. </p><p> This principle will be set down in the new climate agreement, and we have  to make it happen. </p><p> For example, with the help of the new Green Climate Fund, which the Netherlands is keen to contribute to.</p><p>But in order to achieve our international ambitions, it is also vital for government authorities, businesses and civil society organisations to work together at national level. </p><p> Last year, the Netherlands reached a deal with 40 different partners, from Shell to Greenpeace. </p><p> Our common goal is energy innovation, and in this way we will ensure that the Netherlands meets - and even exceeds - its climate goals for 2020. </p><p> My country will cancel an extra 14 million tons of CO2 credits. </p><p> Many other countries in the EU have a similar story to tell.</p><p>The target is a 20 per cent reduction in CO2 emissions in Europe between 1990 and 2020. </p><p> The Netherlands believes that the European target for 2030 should be at least twice that, and for 2050, 80 to 95%. This is very ambitious, but experience teaches that we can accomplish a lot by forming broad coalitions.</p><p>We need to keep using incentives to encourage climate innovation. </p><p> For example, by putting a price tag on CO2 emissions, like the European Emissions Trading Scheme. </p><p> Our philosophy is simple: making sustainability a business case is the best guarantee for a successful climate policy. </p><p> Green growth pays. </p><p> There is a future to be won, and money to be made.</p><p>The focus on cooperation is also visible in the way we in the Netherlands deal with the effects of climate change. </p><p> In our case, this means preparing for a rising sea level and higher peak discharges in the major rivers that flow through our country. </p><p> If Amsterdam Airport is five metres below sea level in a hundred years, planes will still have to be able to land safely. </p><p> That's our mission.</p><p>This battle against water is not new for us, of course. </p><p> But the need to act is clearer and more compelling than ever. </p><p> With this in mind, we've launched a special delta programme in which central government works with municipalities and the water sector. </p><p> The programme is institution-based and well-funded, and it runs all the way to the next century. </p><p> For the first time in our long history of water management, we are not trying to deal with the previous disaster, but looking to the future, to prevent a new one.</p><p>Our special relationship with water and all the specific know-how we've built up over the years brings with it a special responsibility to share this knowledge, exchange expertise and offer assistance. </p><p> The Dutch government and business community are more than willing to do so, especially in developing countries, where large numbers of people and a lot of economic activity are concentrated in low-lying deltas. </p><p> But every country is vulnerable to some degree. </p><p> In this city, which was hit so hard by Hurricane Sandy in 2012, it is fitting to mention the Resilient Cities Initiative, which is sharing state-of-the-art knowledge on water safety with 2,000 cities worldwide. </p><p> We in the Netherlands are also doing our part in this regard. </p><p> And we will continue to do so.</p><p>So, ladies and gentleman, let's act. Let's act now and let's act together. </p><p>Thank you.</p>",1
59,"<p>Your Majesty, </p><p> Your Excellencies, </p><p> ladies and gentlemen,</p><p>I recently read in the paper about a new study at the University of Wageningen. Researchers there are analysing the DNA of generations of Dutch dairy cows. This genetic information tells them whether a cow is likely to produce a lot of milk and whether it will remain healthy. That way, productive cows can be bred without the need for antibiotics. Smart research like this helps feed more mouths and improves animal welfare. And that's what sustainable development is all about in 2014. It's not just a matter for politicians. It's companies and universities, not government, that are creating solutions for today's problems and for the future. Of course, government remains a key enabler. We need to work together. </p><p> We need to build broad-based coalitions between government, businesses and consumers. Only then can we solve the major problems of the 21st century, like hunger, poverty and climate change.</p><p>2015 is an important year for the global development agenda. We'll be reviewing the Millennium Development Goals and raising the bar once again. In July the Open Working Group on Sustainable Development Goals laid a solid foundation for the future that reflects the Netherlands' priorities. We share the hope for a better future and the ambition to make it happen. At tomorrow's climate summit, government, businesses and civil society will once again join forces to create an ambitious climate agreement. In the Netherlands we're working to do the same on a smaller scale. We're pooling knowledge, expertise and resources to reach major goals that no single party could achieve alone. We're joining hands with municipalities, companies, environmental organisations and other parties to create sustainable energy supplies. But you don't always need the government. Look at the research being done in Wageningen. Or at the Dutch Sustainable Growth Coalition, set up in 2012 by eight leading multinationals, including, Heineken, KLM, Shell and my former employer Unilever. Together they're developing and sharing sustainable business models. It won't surprise you that Paul Polman, an esteemed member of the High Level Panel on the Post-2015 Development Agenda, is one of the coalition's leaders.</p><p>It shows the broad support that sustainability now enjoys among the business community. More and more companies are opting for sustainability and corporate social responsibility, in many cases a step ahead of the government.</p><p>Business is leading the way, and not only from noble motives. To quote our host Paul Polman in his speech to the UN: 'it is not just about philanthropy or altruism. It makes business sense.' Sustainability is becoming mainstream. </p><p> Consumers demand it. They want products made in a responsible way. And they stand up to companies who don't meet high standards. Sustainable innovations create income and jobs. So there's a future to be won and money to be made. </p><p> In short, the Sustainable Development Goals can't be achieved without the private sector. Without the University of Wageningen's smart solutions. Without Unilever's Sustainable Living Plan. And without other companies and knowledge centres stepping in. But government plays a role too, bringing companies and research institutions together and promoting sustainable innovation.</p><p>It's all in the theme of this dinner: we're working on a 'transformative change for a brighter future.' </p><p> Thank you.</p>",0
60,"<p>President Battistelli, ladies and gentlemen,</p><p>Abraham Lincoln once said that the US Patent Office 'adds the flame of interest to the light of creativity'. </p><p> A splendid image, and one that applies to the European Patent Office too. </p><p> Patents oil the wheels of economic innovation - a process that never stops. </p><p> It requires creative, technically-gifted people, who are free to experiment and think outside the box. </p><p> But it also involves hard commercial interests. </p><p> Businesses and investors want their euro, dollar or yen to yield a profit, and rightly so. </p><p> A good patent system ensures that risk and return are in balance. </p><p> That's why the EPO has been a driving force behind innovation and economic growth for over forty years.</p><p>The Netherlands was a pioneer of European cooperation in this area. </p><p> And that's no accident. </p><p> Our country has many knowledge-intensive companies, makes many patent applications, and benefits from an efficient European market. </p><p> Two weeks ago we were happy to learn that we had moved from fourth to third place on the list of most innovative European economies. </p><p> And last year the number of Dutch applications to the EPO rose seventeen per cent, to over seven and a half thousand. </p><p> That's one hundred and twenty-nine applications for every million inhabitants - more than in Germany, Japan and the United States.</p><p>We all know that the bigger the international focus of patent policy, the more international business benefits. </p><p> So I'm very pleased that we can finally take a big step towards a single European patent - something the EU agreed in 2013. </p><p> Most member states are on board and that's good news for European business: less expense, less red tape and one Unified Patent Court to deal with disputes. </p><p> It's taken a while, but this key addition to the internal market is finally taking shape. </p><p> I'd like to thank the European Patent Office for the vital contribution it has made. </p><p> The new building here in Rijswijk is a sign that you have confidence in the future. </p><p> That you are ready for a new phase, in which you will also be responsible for implementing the European patent. </p><p> The building will be ultra-sustainable, a shining example of innovation, and proof of your determination to remain the global benchmark for quality. </p><p> And by choosing a Franco-Dutch design team - Jean Nouvel of Paris and Dam and Partners Architecten of Amsterdam - you are also symbolising the importance of European cooperation in the field of patents.</p><p>In short, this is a festive occasion for many players: for Europe, for the European Patent Office, for innovative European businesses and all enterprising universities. </p><p> And above all for the Netherlands - especially The Hague and Rijswijk. </p><p> As the biggest international organisation in the Netherlands, the European Patent Office has been a pillar of the regional economy for forty years. </p><p> But even more important: the new premises will bolster the Netherlands' international image. </p><p> So we are grateful to you.</p><p>Ladies and gentlemen,</p><p>The Netherlands and The Hague are happy that the European Patent Office has its home here. </p><p> I wish everyone - architects, builders and all your staff - every success in the coming years. </p><p> Perhaps we will meet again in 2017, when the new building is completed, twenty-five thousand Dutch-European patent applications down the line.</p><p>Thank you.</p>",3
61,"<p>[Deputy Prime Minister Hai], </p><p> Ladies and gentlemen,</p><p>Thank you for joining this CEO Round Table. It's the second in a short space of time. </p><p> Only three months ago the Dutch Minister for Foreign Trade and Development Cooperation and the Vietnamese Minister of Industry and Trade held a similar event in the Netherlands.</p><p>Clearly, we have more and more to talk about! </p><p> Trade relations between the Netherlands and Vietnam go back four centuries, when the first Dutch ships reached your shores. </p><p> Today the Netherlands is Vietnam's largest investor and third-biggest trading partner in the European Union. </p><p> In the last decade, the value of trade between our two countries has increased almost tenfold, to 3.6 billion dollars.</p><p>So economic ties between Vietnam and the Netherlands are booming. </p><p> And I'm confident that the Free Trade Agreement between the EU and Vietnam will further boost trade and investment to our mutual benefit. </p><p> I strongly believe that Vietnam and the Netherlands are natural allies. </p><p> We are both world players in the export of agricultural products. </p><p> We are both coastal states with strategic locations, and we excel in maritime affairs and logistics. </p><p> And as delta countries, we both face the challenges of climate change, especially in the fields of water management and energy. </p><p> So I've come to Vietnam with representatives of major Dutch companies active in these four sectors of mutual interest: water and maritime affairs, agriculture and energy.</p><p>The fact that we're holding another Round Table shows that Dutch companies want to do more business in Vietnam. </p><p> There are already around 120 firms active here. </p><p> Some of the companies in my delegation are taking their first steps in the Vietnamese market. </p><p> Others have been in Vietnam for decades. </p><p> And they tell us that Vietnam - with its location, its young, hard-working population and its fast-growing domestic market - provides ample business opportunities. </p><p> But they also tell us about the challenges companies face when doing business here.</p><p>I hope that today we can openly discuss what it will take to fully exploit the economic potential between our countries. </p><p> My government remains committed to helping Vietnam open up its economy, enhance its policies and become more competitive in this emerging region. </p><p> But in the end, it's all down to the business sector. </p><p> Economic growth and employment come about when companies meet and see joint opportunities. </p><p> Because entrepreneurs speak a universal language.</p><p>The rapid growth of trade between our two countries shows how important it is - and how profitable it can be - to invest in relationships. </p><p> To keep reinforcing our ties. </p><p> That's what we're doing today, at this Round Table. </p><p> Our goal is to sow the seeds of future partnerships. </p><p> And I have every confidence we'll succeed.</p><p>I hope you have an inspiring and productive meeting.</p><p>Thank you.</p>",4
