,text,economy
0,"<p>Ladies and gentlemen,</p><p>It is an honour to be here today to introduce the theme of 'recession and recovery'. If you will permit, I would like to suggest that this afternoon we focus more on recovery than on recession. I think we know enough about the recession side of the story.</p><p>It started with the fall of Lehman Brothers on 15 September 2008. I happened to be here, at the Blouin Creative Leadership Summit, only ten days later. Everyone was talking about the collapse of Lehman. They were shocked and alarmed. But even then we could hardly imagine that its impact would be so dramatic, so historic.</p><p>As we now know, this event triggered a global financial and economic crisis. Governments were forced to give cash injections running into billions to prevent an economic and financial meltdown. When credit dried up and demand fell, businesses struggled to keep their heads above water, and many went under. Ordinary people's jobs, homes and pensions were at risk.</p><p>The aftermath was high unemployment in the US and Europe: around ten per cent. And in many countries public finances were thrown completely out of balance.</p><p>The question now is: what can we do? What does the road to economic recovery look like? The road to a sustainable and balanced recovery, I should firmly add. Because only a sustainable and balanced recovery can prevent future imbalances in our economic system. Only a sustainable and balanced recovery will enable us to combine economic growth with measures to tackle other global challenges: to combat climate change, to maintain biodiversity, to fight international terrorism, to resolve migration issues and to find a response to the major shortages of natural resources - oil, gas, food and water.</p><p>There are two dimensions to this theme: short-term recovery, and measures to bring about a sustainable, long-term recovery.</p><p>Let us take a brief look at each dimension. The current debate on short-term recovery revolves around whether our vulnerable economies need further stimulus, or whether it is time for governments to withdraw because the private sector can once again play its natural role as the engine of economic growth.</p><p>Opinions on what we should do vary widely. I'm sure that applies to you too. And that is understandable. After all, there's no such thing as one truth or one answer. The differences between countries, or rather, between their citizens' behaviour, are simply too big.</p><p>For example, Dutch companies and citizens get uncomfortable if their government runs up an enormous debt and makes it bigger by continuing to spend regardless. If that happens, they keep a tight hold on the purse strings - companies invest less, and ordinary people save more. They are well aware that sooner or later they will pay the price for their government's runaway spending. In the form of higher taxes and higher contributions towards health care, education and pensions.</p><p>They will only start spending again in a climate of economic certainty and financial stability. In America things are different, as you probably know better than I do.</p><p>So this is why - in my country at least - I argue for budget discipline, reforms and a reduction of government deficits. In both the short and the long term.</p><p>I fully agree with Olivier Blanchard and Carlo Cottarelli - chief economist and head of fiscal affairs at the IMF - that we should not become obsessed with short-term policy. They recently wrote an article in the Financial Times entitled 'The great false choice, stimulus or austerity'. They conclude, and I quote, 'But more important are measures that improve the long-term fiscal outlook in those countries with high deficits and debt. This is where governments should focus their efforts. For without long-term fiscal reforms, lasting recovery is doomed far more certainly than if the world gets 2011 plans wrong by a fraction of a per cent of GDP.'</p><p>In other words, long-term measures are the surest route to sustainable recovery. So let us focus on these above all.</p><p>If you ask me what I think is crucial to make our world, our economies and our lives more stable, more sustainable and more dynamic in the future, I can sum up the answer in one word: values.</p><p>Two weeks ago, on the website of the The New York Times, I read an analysis by Thomas Friedman that struck a chord with me. Let me give you an idea of his central message. He wrote 'We had a values breakdown - a national epidemic of get-rich-quickism and something-for-nothingism. Wall Street may have been dealing the dope, but our lawmakers encouraged it. And far too many of us were happy to buy the dot-com and subprime crack for quick prosperity highs. […] China and India have been catching up to America not only via cheap labour and currencies. They are catching us because they now have free markets like we do, education like we do, access to capital and technology like we do, but, most importantly, values like our Greatest Generation had. That is, a willingness to postpone gratification, invest for the future, work harder than the next guy and hold their kids to the highest expectations. In a flat world where everyone has access to everything, values matter more than ever.'</p><p>Of course, we need to reform our economic, tax and financial systems to make them more robust and better able to withstand future challenges. For example, by raising our retirement age, making the labour market more flexible, and improving supervision in the financial sector. But a successful future demands another fundamental reform: a greater moral awareness. Globally. Nationally. In business and among ordinary people.</p><p>Let me outline what I mean.</p><p>Globally, I hope that we can further intensify our current international cooperation. In good times and bad. When the crisis was deepest, the G20 assumed a prominent role and declared itself the premier forum for economic cooperation. It certainly lived up to that promise, as I know from personal experience. It launched a framework for strong, sustainable and balanced growth, which I applaud. But it is only a framework. What matters now is to fill in the detail, and to harmonise our policies in practice.</p><p>The G20 is still struggling with its ambition of truly sustainable and balanced growth. The issue of scarcity seems to have faded from view because of the crisis, but I predict that if the G20 ignores it, it will surely be back on the agenda in a few years. This is why I say: now is the time to take our moral responsibility. By taking concrete action to tackle climate change, for example. The climate summit in Cancun is an excellent opportunity to make real progress. </p><p>National governments also have their part to play. The lessons of this crisis are harsh. There are no two ways about it. We owe it to the next generation to introduce structural reforms. To exercise proper stewardship and put public finances back in order. To act now to address the problem of demographic ageing, so that our children are not left to sort it out. To ensure that the financial sector first and foremost serves the real economy, the business community and the general public.</p><p>Businesses have their own responsibility here. And I'm not only talking about banks. People who line their own pockets, excessive bonuses, perverse incentives, short-termism, reckless risk-taking: as we have seen - and still see, unfortunately - this kind of thing is not unique to the financial sector. </p><p>In my view, we can achieve sustainable recovery and growth only if businesses and business people behave more responsibly. If they go much further in embracing corporate social responsibility. Not because terms like 'green' or 'sustainable' or 'socially responsible' are good for their image and boost sales. But because they really do feel a long-term responsibility for the world in which they operate, and for their role in it.</p><p>And finally ourselves, ordinary citizens. We too will have to be guided more by moral principles in the future. By standards and values. The value of saving. The value of social engagement. The value of caring for others. These are the kind of values that - to use Friedman's words again - 'matter more than ever'. Without moral awareness there can be no sustainable recovery.</p><p>Let us continue resolutely on the road to recovery. Without running away from our responsibilities. Not in the short term, and certainly not in the long.</p><p>Thank you.</p>",10
1,"<p>Ladies and gentlemen,</p><p>Today we are looking back at the ten years since the Millennium Development Goals were agreed. But we are also looking forward. We still have five years to go. Five years to make a difference for all those people for whom poverty, hunger and shortages are still everyday realities.</p><p>Looking back, we have good reason to be satisfied with what we have achieved in some areas in the past ten years. Poverty, child mortality and malaria have all been reduced. More girls are attending school. And more people have access to clean drinking water - a subject to which the Netherlands, and in particular our crown prince, are deeply committed.</p><p>At the same time, there is cause for concern. Because our aims are ambitious, but we are moving too slowly. That applies in particular to the MDGs on reducing maternal mortality and achieving equality between men and women. Progress is lagging far behind, and we cannot allow that to happen. So we will have to do better. And we can do better, if we are prepared to think and work outside the box.</p><p>Too often, the Millennium Development Goals are still seen as the sole responsibility of NGOs, governments and multilateral organisations. This is unwise, because the commitment of the private sector is crucial to achieving them. Its knowledge and expertise in fields such as science, logistics and innovation enable us to push forward boundaries in development. Above all, however, the private sector is both a source of and a stimulus to employment, sustainable development and economic growth.</p><p>Research shows that economic growth accounts for 80 per cent of poverty reduction in the world. When per capita income increases, the poorest 20 per cent of the population also benefit. And the higher the growth is and the longer it lasts, the faster poverty rates drop. The same free market principles also operate at grassroots level. We will speak about that later today, when I host a side-event on inclusive finance in the presence of Her Royal Highness Princess Máxima, the Secretary-General's Special Advocate for Inclusive Finance for Development.</p><p>So we know that within certain parameters, the mechanisms of the free market are essential for development. But we also know that investing in developing countries is still regarded by many as a risky business. So to get economic growth in gear, the private sector needs a helping hand.</p><p>That is why the Dutch government is strongly in favour of public-private partnerships. We recently drafted a bilateral donors' statement in support of private sector partnerships for development. Rather than viewing the private sector merely as a cash dispenser, this statement recognises that it is an equal partner in development. We are in this together with the governments of Austria, Denmark, Germany, Sweden, Switzerland, the UK and the US. The International Finance Corporation and UNDP are also involved.</p><p>The governments of the Netherlands Antilles and Aruba strongly support this policy of working with the private sector to achieve the MDGs. The upcoming Netherlands Antilles MDG Report will not only emphasise this but also strengthen existing partnerships.</p><p>In a recent letter to co-facilitators, written jointly with the CEOs of several Dutch multinationals, the Dutch government emphasised the importance of innovative partnerships. I quote: </p><p>'The Netherlands believes that greater collaboration between government and business could be instrumental, as it would combine the knowledge and experience of the public sector with the creative solutions and technical expertise of the private sector.'</p><p> I am proud that so many Dutch companies are here at this week's summit to prove that our approach really works.</p><p>Ladies and gentlemen,</p><p>To achieve the MDGs, innovative thinking is needed in every field. This applies in particular to MDG3 and MDG5. Every year, over 350,000 women are still dying during pregnancy or childbirth, and in many cases women are still being denied equal rights. Shortly before my departure for New York, I was presented with a petition signed by thousands of Dutch mothers who find it unacceptable that during this summit more than 4,400 women will die during pregnancy or childbirth.</p><p>Like these mothers, the Dutch government believes - and I believe - that equal rights and opportunities for women bring the achievement of most other MDGs closer. Burkina Faso is a good example. By addressing harmful practices and discrimination against women, by expanding and improving family planning services, by committing itself to removing obstacles to health care, this country was able to reduce the number of needless deaths substantially.</p><p>Human rights play a crucial role on the road to 2015. By ensuring equality and non-discrimination, we give the poorest and most vulnerable groups access to basic services. Accountability, the right to participation and freedom of information will enable our efforts to meet the real needs of the population. And making things accessible and affordable ensures that the MDGs are more than a short-term success.</p><p>The key, ladies and gentlemen, is that we combine our strengths and efforts. As members of the UN, as donors and developing countries, and especially as governments and businesses.</p><p>Thank you.</p>",3
2,"<p>Prime Minister Harper, Excellencies, honoured veterans, ladies and gentlemen, </p><p>He was seventeen years old. Private Stanley Colquhoun from Vancouver.He was seventeen when he fought in the Netherlands for freedom.Seventeen when he fought in the Battle of the Scheldt. And seventeen when he lost his life on Dutch soil in the cause of freedom. He was laid to rest here in Bergen op Zoom. This young Canadian made the supreme sacrifice. He gave his life. In the grimmest, fiercest and most savage battle fought by the Canadian army in the Second World War.</p><p>This is what one veteran said about conditions in 1944. 'We were always wet, always cold. The shelling never let up, the fighting just went on day after day. I thought it'd never end.' These words come from the book 'A terrible victory', the harrowing story of the Scheldt offensive. It was presented to me by the author Mark Zuehlke in Vancouver several months ago. At the presentation, I met two Canadian veterans who had been involved in the fighting and in the liberation of Zeeland. Their stories made a deep impression on me. I was born in 1956 in the same area where they had seen so much horror. I grew up there in safety, peace and security.</p><p>Today we remember how the Canadians and their allies struggled to bring peace and security to the Netherlands and the Dutch people. We are deeply grateful for the sacrifices they made. We admire their courage and their determination. And we are filled with respect for their sense of duty and responsibility.</p><p>Today we also remember the priceless gift they gave us: the gift of freedom. Sixty-five years ago, the Nazi occupiers were driven from our country. Sixty-five years ago despair and oppression made way for hope and promise. Sixty-five years ago the Netherlands was liberated.</p><p>Yesterday we celebrated our liberation with the war veterans. And, equally important, with thousands of Canadian students who are in the Netherlands this week to learn about the past. This week they will walk in the footsteps of their fellow Canadians. Canadians who were not much older than they are now when they fought a battle of life and death in 1944 and 1945. They will see where the frontline was, and where people lit bonfires to celebrate their liberation. They will hear about the courage of their fellow Canadians in the face of fear. They will feel the eternal gratitude of the Dutch people for the bravery of the Canadian solders.</p><p>It is essential that we pass on the torch of history to the next generation. That we continue to tell the story of war, and the story of peace. So that every day we feel in the very fibres of our being how precious our freedom is. How freedom cannot be taken for granted. And how freedom goes hand in hand with responsibility. The responsibility to cherish the gift of freedom and to pass it on. And the responsibility to remain alert to intolerance, to discrimination and to anything that threatens our freedom.</p><p>We owe it to him. To Stanley Colquhoun. And to the many thousands who fought for peace in the Netherlands. To those who fell, and those who survived. Our liberators. Our heroes. Forever.</p><p>Thank you.</p>",0
